{"$id":"QK_GBFP8_HEAD64_GRANULARITY_SWEEP_EXECUTION_V17_EXACTLY_ONCE_OWNER_CLAIM_SCHEMA","$schema":"https://json-schema.org/draft/2020-12/schema","additionalProperties":false,"properties":{"action_id":{"const":"ace2:qk-gbfp8-base-v17:execute-once:4c8a6e31:20260814T102500Z"},"action_retired":{"const":true},"artifact_kind":{"const":"qk_gbfp8_head64_granularity_sweep_execution_v17_exactly_once_owner_claim"},"first_record_immutable":{"const":true},"owner_claim_sha256":{"pattern":"^[0-9a-f]{64}$","type":"string"},"retry_replay_resume_repair_replacement_permitted":{"const":false},"state":{"const":"OWNER_CLAIMED"}},"required":["action_id","action_retired","artifact_kind","first_record_immutable","owner_claim_sha256","retry_replay_resume_repair_replacement_permitted","state"],"type":"object"}
