{"action_id":"ace2:qk-gbfp8-base-v17:execute-once:4c8a6e31:20260814T102500Z","action_retired":true,"artifact_kind":"qk_gbfp8_head64_granularity_sweep_execution_v17_exactly_once_owner_claim","first_record_immutable":true,"owner_claim_sha256":"7da9a129e85deb549ecdb21dc14d76b4de4b022f6311d3ee6c0c88a27a2c1c62","retry_replay_resume_repair_replacement_permitted":false,"state":"OWNER_CLAIMED"}
